{"acceptance": ["All matrix cells are bound."], "allowed_inputs": ["EXPERIMENTS/EXP-LEO-V2-PRE-TRUST-REPRO"], "cannot_claim": ["No run or performance claim."], "cost_tier": "high_judgment", "deliverables": ["Bound matrix authorization"], "excluded_inputs": [], "objective": "Review matrix artifacts before execution.", "parent_revision": null, "producer_id": "producer:test", "producer_session_id": "P-matrix-r01", "review_roles": ["cold_start", "satellite_drl", "adversarial"], "revision": 1, "schema": "agent-work-package/v2", "status": "REVIEW", "work_id": "WP-MATRIX"}
