{"acceptance": ["Both cells are bound and authorized."], "allowed_inputs": ["EXPERIMENTS/EXP-LEO-V2-ACCEPT-R4"], "cannot_claim": ["No run, performance or scientific claim."], "cost_tier": "high_judgment", "deliverables": ["Bound matrix authorization"], "excluded_inputs": [], "objective": "Accept the platform chain on the two smallest formal cases after the pre-experiment trust changes.", "parent_revision": null, "producer_id": "producer:platform-acceptance", "producer_session_id": "P-accept-r1", "review_roles": ["cold_start", "satellite_drl", "adversarial"], "revision": 1, "schema": "agent-work-package/v2", "status": "REVIEW", "work_id": "WP-LEO-V2-ACCEPT-R4"}
