{
  "acceptance": [
    "both matrices compile with COMPILED_REVIEW_REQUIRED, errors=[], execution_authorized=false",
    "the micro acceptance gate is min_delivered_packets=6 and min_multisat_deliveries=6 (all six packets delivered over a real multi-satellite path); the corridor gate is deliberately low (1/1) because it is a diagnostic-scale recomputation batch and the corridor legitimately drops load at the edge with ACCESS_QUEUE_OVERFLOW",
    "every formal run reaches natural_end=true with conservation_ok=true and research_eligible=true, or the batch stops and reports rather than substituting",
    "no receipt/ledger key set is modified and no old evidence file is deleted or moved",
    "the substituted decision-count witness is accepted ONLY where trace_sha256 and the packet_events/link_service_windows digests are bit-identical between the formal run and the diagnostic re-execution; otherwise the witness is reported as unavailable",
    "any per-link utilisation mismatch and any gap that is not exactly compute_delay_s is reported individually, never summarised away"
  ],
  "allowed_inputs": [
    "EXPERIMENTS/request-sources/EXP-20260923-T1-STEP5-MICRO-R01.json",
    "EXPERIMENTS/request-sources/EXP-20260923-T1-STEP5-PRESSURE-R01.json",
    "EXPERIMENTS/EXP-20260923-T1-STEP5-MICRO-R01/",
    "EXPERIMENTS/EXP-20260923-T1-STEP5-PRESSURE-R01/",
    "CODE/data/traffic/t1_step5_micro_ab.csv",
    "CODE/leo_sim/profiles/t1_pressure_corridor.yaml",
    "CODE/leo_sim/metrics_independent.py",
    "CODE/leo_sim/matrix.py",
    "CODE/work/WP-LEO-V2-T1-STEP5-GATE-EVIDENCE/R01/artifact-set.json",
    "CODE/work/WP-LEO-V2-T1-STEP5-GATE-EVIDENCE/tools/step5_recompute.py",
    "CODE/scripts/remote/run-remote.sh",
    "CODE/scripts/remote/remote_job.py",
    "CODE/experiment_platform/authorize_experiment.py",
    "CODE/leo_sim/tests/test_micro_mechanism.py"
  ],
  "cannot_claim": [
    "that any review gate is closed; gate closure is the initiator's decision and is explicitly not made by this work package",
    "any algorithmic superiority, information value, learning value, or new-mechanism contribution",
    "an effect-size, performance curve, threshold or causal claim about compute delay",
    "reproduction of the #212 micro-mechanism fixture or of any M1/M2/M3 scripted-geometry result",
    "restoration or recovery of any lost R02 raw data",
    "real subscriber traffic, or a calibrated demand model"
  ],
  "context": [
    "This batch exists only to produce gate evidence for review step 5. It is NOT the T1 main experiment, it trains no model, and it changes no production semantics.",
    "Two experiments are compiled, each a strict 2-cell paired design over ONE declared factor: execution.compute_delay_s (control 0.0 vs cd05 0.05). Trace identity, seed, endpoints, PHY and every other field are shared; the compiler enforces this via controlled_signature equality across the pair.",
    "EXP-20260923-T1-STEP5-MICRO-R01: 8 satellites / 1 plane real Walker geometry, demand.mode=csv with an explicit 6-row table (CODE/data/traffic/t1_step5_micro_ab.csv): one warm-up packet at t=0 and a 5-packet burst at t=3.00..3.20, 8e6 bits each, A=(0.1N,0.1E) -> B=(52.6N,90.4E), isl_rate 10 Mbps, uplink/downlink 1000 Mbps, control plane on (vis_k=2), routing hop, available_capacity_interval_s=0.1.",
    "EXP-20260923-T1-STEP5-MICRO-R01 is NOT a reproduction of the #212 micro-mechanism fixture. That fixture uses tests/helpers.py StaticGeometry (a scripted 4-cycle plus an isolated satellite with a scripted visibility predicate). No formal config can express scripted geometry: kernel.py:1065-1071 falls back to model.Constellation (real Walker-delta) when no geometry object is injected, and the formal CLI never injects one. This batch therefore reuses ONLY the fixture's ROW TABLE SHAPE (warm-up + burst emission schedule, 8e6-bit packets) and its PHY/control parameters, on the known-good reachable site pair taken from the t1_pressure_corridor profile. No #212 or M1/M2/M3 mechanism conclusion may be drawn from this batch.",
    "EXP-20260923-T1-STEP5-PRESSURE-R01: the EXISTING 24-satellite ISL pressure corridor. Its common_config is field-for-field identical to CODE/leo_sim/profiles/t1_pressure_corridor.yaml (profile file sha256 60bcb666160e72159018feaf2f93c7f2f01888cc06cd4655c04ed5b5aab2dc4e), which is a config file rather than a named profile (config.py:410 registers only 'smoke'). Equivalence is machine-checked, not asserted: load_config_file(profile) and resolve_config(inlined common_config) both resolve to config_sha256 d45c6a50580958c3d14bc7ff576cb36f0f57c91953e12c8c80478842277fd27f, and that value equals the compiled control-arm config_sha256. No 280-satellite scenario was created.",
    "execution.available_capacity_interval_s is non-null in BOTH experiments (1.0 for the corridor, 0.1 for the micro). This is required: the independent recomputation reports DEGENERATE_DENOMINATOR with utilization=None when no availability sample exists, and a degenerate group must not be used as gate evidence. The corridor profile comment at CODE/leo_sim/profiles/t1_pressure_corridor.yaml:69-73 states the same requirement.",
    "Neither request declares execution_policy, so the v2_serial_gate predecessor gate is a documented no-op (v2_serial_gate.py:52-55) and the two cells of each experiment may be launched independently. This is a deliberate, disclosed design choice: the batch measures static recomputation agreement, not a serial ordering effect.",
    "KNOWN PLATFORM LIMITATION that the reviewers must assess: a formal authorized run CANNOT carry a decision audit log. __main__.py:332-335 refuses --decision-log when the run is formal ('decision audit log is diagnostic-only and cannot be attached to a formal authorized run'), and remote_job.formal_command (remote_job.py:303-310) never passes it, so decision_sink is None and ledgers.json (receipt.py:544-556) contains no decision rows. The task's original witness ('decision_sink rows with t > t_decision_start') is therefore NOT obtainable from formal artifacts. The substitute witness is a deterministic local non-formal diagnostic re-execution of the SAME resolved config with --decision-log, which is only admissible if it is proven to be the same execution as the formal run (identical trace_sha256 AND bit-identical packet_events/link_service_windows digests). If that proof fails for any cell, the decision-count witness must be reported as unavailable for that cell and no substitute may be used.",
    "Both experiments use real Walker geometry and are therefore descriptive of this platform's mechanics only; the corridor retains the profile's ACCESS_QUEUE_OVERFLOW behaviour, which is a real property of the existing profile and not a defect introduced here."
  ],
  "cost_tier": "high_judgment",
  "deliverables": [
    "a clean compiled matrix for both experiments, errors=[], execution_authorized=false",
    "natural-end formal run receipts for all 4 cells with research_eligible and external launch witness",
    "an independent per-directed-link utilisation table recomputed from the immutable event record, covering zero-service links, zero-capacity links and window-boundary cases, with any per-link disagreement against the production reading listed one by one",
    "a per-packet delay decomposition where EVERY uncovered interval is individually shown to equal compute_delay_s, with any gap that is not exactly compute_delay_s listed with packet id, time and length",
    "fate-appropriate truncated accounting for every non-delivered packet, reported per fate class",
    "the raw recomputation JSON outputs persisted in the canonical VM results location with a sha256 inventory"
  ],
  "excluded_inputs": [
    "the #212 scripted-geometry fixture results as formal evidence for this batch",
    "the R02 GLOBAL-PRESSURE-BRACKET raw results (lost; not recoverable and not recoverable by this batch)",
    "the unmerged F2 branch agent/20260923-t1-f2-node-cost (out of scope, must not be used or modified)",
    "learning / checkpoint artefacts (no learning arm exists in this batch)",
    "any post-hoc change of thresholds, acceptance values or analysis contracts after seeing results"
  ],
  "objective": "Produce a bounded, review-gated formal VM evidence batch whose only purpose is to supply the two evidence chains required to consider closing review step 5: (1) an independent per-directed-link utilisation recomputation from the immutable event record, and (2) a per-packet delay decomposition whose uncovered intervals are each proven equal to the configured compute_delay_s, with fate-appropriate truncated accounting for packets that were not delivered.",
  "parent_revision": null,
  "producer_id": "producer:step5-batch-deepseek",
  "producer_session_id": "P-step5-batch-r01",
  "review_roles": [
    "cold_start",
    "satellite_drl",
    "adversarial"
  ],
  "revision": 1,
  "schema": "agent-work-package/v2",
  "status": "REVIEW",
  "work_id": "WP-LEO-V2-T1-STEP5-GATE-EVIDENCE"
}
